[
  { "id": "s1", "title": "Exploring fascia in myofascial pain syndrome: an integrative model of mechanisms", "type": "review", "citation": "Front. Pain Res. 2025 — integrative MPS mechanisms model", "url": "https://www.frontiersin.org/journals/pain-research/articles/10.3389/fpain.2025.1712242/full", "year": 2025, "found_by": ["mechanism", "conditions"], "status": "cited", "basis": "fulltext" },
  { "id": "s2", "title": "Potential Nociceptive Role of the Thoracolumbar Fascia: A Scope Review Involving In Vivo and Ex Vivo Studies", "type": "review", "citation": "Life (Basel) 2021 — thoracolumbar fascia nociception scope review", "url": "https://pmc.ncbi.nlm.nih.gov/articles/PMC8509394/", "year": 2021, "found_by": ["mechanism"], "status": "cited", "basis": "fulltext" },
  { "id": "s3", "title": "An Emerging Perspective on the Role of Fascia in Complex Regional Pain Syndrome: A Narrative Review", "type": "review", "citation": "Int. J. Mol. Sci. 2025 — fascia in CRPS narrative review", "url": "https://pmc.ncbi.nlm.nih.gov/articles/PMC11942918/", "year": 2025, "found_by": ["mechanism", "conditions"], "status": "cited", "basis": "fulltext" },
  { "id": "s4", "title": "Molecular Mechanisms Underlying the Pain-Relieving Effects of Extracorporeal Shock Wave Therapy: A Focus on Fascia Nociceptors", "type": "review", "citation": "2022 — ESWT and fascia nociceptors", "url": "https://pmc.ncbi.nlm.nih.gov/articles/PMC9146519/", "year": 2022, "found_by": ["mechanism", "treatments"], "status": "cited", "basis": "fulltext" },
  { "id": "s5", "title": "Understanding Fascial Tissue on the Molecular Level — How Its Unique Properties Enable Adaptation or Dysfunction", "type": "review", "citation": "2025 — fascia molecular level; Ca2+-hyaluronan mechanotransduction", "url": "https://www.ncbi.nlm.nih.gov/pmc/articles/PMC12785924/", "year": 2025, "found_by": ["mechanism"], "status": "read", "basis": "abstract" },
  { "id": "s6", "title": "Reduced thoracolumbar fascia shear strain in human chronic low back pain", "type": "journal-article", "citation": "Langevin et al. 2011, BMC Musculoskelet. Disord.", "url": "https://link.springer.com/article/10.1186/1471-2474-12-203", "year": 2011, "found_by": ["conditions", "measurement"], "status": "cited", "basis": "fulltext" },
  { "id": "s7", "title": "Ultrasound Imaging of Thoracolumbar Fascia Thickness: Chronic Non-Specific Lower Back Pain versus Healthy Subjects; A Sign of a \"Frozen Back\"?", "type": "journal-article", "citation": "2023 — TLF thickness in chronic LBP ('frozen back')", "url": "https://pmc.ncbi.nlm.nih.gov/articles/PMC10137552/", "year": 2023, "found_by": ["conditions", "measurement"], "status": "cited", "basis": "fulltext" },
  { "id": "s8", "title": "Fascia: A missing link in our understanding of the pathology of fibromyalgia", "type": "review", "citation": "Liptan 2010, J. Bodyw. Mov. Ther. (hypothesis)", "url": "https://www.sciencedirect.com/science/article/abs/pii/S1360859209000941", "year": 2010, "found_by": ["conditions", "mechanism"], "status": "cited", "basis": "abstract" },
  { "id": "s9", "title": "The widespread myofascial pain of fibromyalgia is sympathetically maintained and immune mediated", "type": "review", "citation": "2023, J. Bodyw. Mov. Ther. (PMID 37330799)", "url": "https://pubmed.ncbi.nlm.nih.gov/37330799/", "year": 2023, "found_by": ["conditions", "mechanism"], "status": "cited", "basis": "abstract" },
  { "id": "s10", "title": "Scoping review and interpretation of myofascial pain/fibromyalgia syndrome: An attempt to assemble a medical puzzle", "type": "review", "citation": "2022 (PMID 35171940)", "url": "https://pubmed.ncbi.nlm.nih.gov/35171940/", "year": 2022, "found_by": ["conditions"], "status": "read", "basis": "abstract" },
  { "id": "s11", "title": "Effectiveness of myofascial release in treatment of chronic musculoskeletal pain: a systematic review", "type": "systematic-review", "citation": "Laimi et al. 2018, Clin. Rehabil.", "url": "https://pubmed.ncbi.nlm.nih.gov/28956477/", "year": 2018, "found_by": ["treatments"], "status": "cited", "basis": "abstract" },
  { "id": "s12", "title": "Myofascial Release for Chronic Low Back Pain: A Systematic Review and Meta-Analysis", "type": "systematic-review", "citation": "Front. Med. 2021 (meta-analysis)", "url": "https://pmc.ncbi.nlm.nih.gov/articles/PMC8355621/", "year": 2021, "found_by": ["treatments"], "status": "cited", "basis": "fulltext" },
  { "id": "s13", "title": "Extracorporeal shockwave therapy versus placebo for chronic proximal plantar fasciitis: a randomized, placebo-controlled, double-blinded, multicenter trial", "type": "trial", "citation": "2006 RCT (PMID 16818146)", "url": "https://pubmed.ncbi.nlm.nih.gov/16818146/", "year": 2006, "found_by": ["treatments", "conditions"], "status": "cited", "basis": "abstract" },
  { "id": "s14", "title": "Is Extracorporeal Shock Wave Therapy Clinically Efficacious for Relief of Chronic, Recalcitrant Plantar Fasciitis? A Systematic Review and Meta-Analysis of RCTs", "type": "systematic-review", "citation": "2014 systematic review / meta-analysis", "url": "https://www.sciencedirect.com/science/article/abs/pii/S000399931400207X", "year": 2014, "found_by": ["treatments", "conditions"], "status": "cited", "basis": "abstract" },
  { "id": "s15", "title": "Evaluation of hyaluronan content in areas of densification compared to adjacent areas of fascia", "type": "journal-article", "citation": "2019, J. Bodyw. Mov. Ther. (fascial densification / hyaluronan)", "url": "https://www.sciencedirect.com/science/article/abs/pii/S1360859219300713", "year": 2019, "found_by": ["mechanism", "treatments"], "status": "cited", "basis": "abstract" },
  { "id": "s16", "title": "Shear wave elastography based analysis of changes in fascial and muscle stiffness in patients with chronic non-specific low back pain", "type": "journal-article", "citation": "Front. Bioeng. Biotechnol. 2024 (SWE, TLF stiffness vs ODI)", "url": "https://pmc.ncbi.nlm.nih.gov/articles/PMC11604440/", "year": 2024, "found_by": ["measurement", "conditions"], "status": "cited", "basis": "fulltext" },
  { "id": "s17", "title": "Shear wave elastography provides reliable assessments of stiffness in the skin, fascia, and both superficial and deep muscle tissues", "type": "journal-article", "citation": "2025 — SWE reliability across tissue layers", "url": "https://www.sciencedirect.com/science/article/pii/S1050641125000768", "year": 2025, "found_by": ["measurement"], "status": "cited", "basis": "abstract" },
  { "id": "s18", "title": "Fascial Nomenclature: Update 2024", "type": "review", "citation": "Schleip et al. 2024, Clinical Anatomy (nomenclature consensus)", "url": "https://pmc.ncbi.nlm.nih.gov/articles/PMC10858998/", "year": 2024, "found_by": ["directions"], "status": "cited", "basis": "fulltext" },
  { "id": "s19", "title": "Deep fascia as a potential source of pain: A narrative review", "type": "review", "citation": "2021, J. Bodyw. Mov. Ther.", "url": "https://www.sciencedirect.com/science/article/abs/pii/S1360859221001601", "year": 2021, "found_by": ["mechanism", "directions"], "status": "cited", "basis": "abstract" },
  { "id": "s20", "title": "Fascia as a regulatory system in health and disease", "type": "review", "citation": "Front. Neurol. 2024", "url": "https://www.frontiersin.org/journals/neurology/articles/10.3389/fneur.2024.1458385/full", "year": 2024, "found_by": ["directions"], "status": "read", "basis": "fulltext" },
  { "id": "s21", "title": "The Role of Fascia in Chronic Pain: Pathways, Mechanisms, and Functional Patterns (practitioner blog)", "type": "web", "citation": "Practitioner blog — non-peer-reviewed", "url": "https://www.functionalpatternsbrisbane.com/blog-page/the-role-of-fascia-in-chronic-pain-pathways-mechanisms-and-functional-patterns", "year": 2024, "found_by": ["mechanism"], "status": "discarded", "basis": "snippet", "note": "Non-peer-reviewed marketing blog; surfaced by search but excluded from the evidence base." }
]
